{
  "schemaVersion": "atlasrepo.core/task-dossier/v0.2",
  "id": "5fefbbdc-89ae-4a39-a051-1ae64f2a156f",
  "revision": 2,
  "createdAt": "2026-09-05T00:00:00+07:00",
  "updatedAt": "2026-09-05T01:00:00+07:00",
  "title": "Assess Dify for a bounded self-hosted LLM platform pilot",
  "context": {
    "description": "Assess whether a small engineering team should run a bounded local Dify pilot for visual LLM workflows and retrieval applications. Current evidence is limited to public source files at one pinned revision; no Dify code or containers were executed.",
    "constraints": [
      {
        "id": "constraint-public-pinned",
        "description": "Use only public evidence pinned to langgenius/dify revision ad90cb911138f6b27af996c87afe34fbb5a4ed16.",
        "required": true
      },
      {
        "id": "constraint-no-runtime-claim",
        "description": "Do not infer runtime, performance, security, production fitness, or license compatibility from source documentation.",
        "required": true
      },
      {
        "id": "constraint-license-review",
        "description": "Require qualified human review of the modified license for the intended tenancy, branding, and distribution model.",
        "required": true
      },
      {
        "id": "constraint-local-pilot",
        "description": "Require a separately authorized sandboxed local pilot before adoption or deployment.",
        "required": true
      },
      {
        "id": "constraint-security-operations",
        "description": "Require independent security and operations reviews before production use.",
        "required": true
      }
    ]
  },
  "evidence": [
    {
      "id": "ev-revision",
      "kind": "document",
      "title": "Pinned Dify main revision observation",
      "resourceRef": "git+https://github.com/langgenius/dify.git#commit=ad90cb911138f6b27af996c87afe34fbb5a4ed16",
      "publicUri": "https://github.com/langgenius/dify/commit/ad90cb911138f6b27af996c87afe34fbb5a4ed16",
      "digest": "sha256:931679421a809e6319d89facb90a90c472de65bb38a0b9b0a34c265ddd5cc30c",
      "observedAt": "2026-09-05T00:00:00+07:00",
      "producer": { "name": "git-ls-remote", "version": "system" },
      "accessHint": "public",
      "limitations": [
        "The main branch can move after this observation; all file evidence is pinned to the observed commit.",
        "The timestamp is normalized to the observation date; the exact retrieval second was not retained."
      ]
    },
    {
      "id": "ev-repository-metadata",
      "kind": "repository-analysis",
      "title": "GitHub repository metadata observation",
      "resourceRef": "atlasrepo-example:dify-public-repository-evidence-2026-09-05#ev-repository-metadata",
      "publicUri": "https://github.com/langgenius/dify",
      "digest": "sha256:f8f51f34134d9750bc6641fe8cbb900ce4958524a48f1e5a0932a2ddffd71526",
      "observedAt": "2026-09-05T00:00:00+07:00",
      "producer": { "name": "gh-cli", "version": "api" },
      "accessHint": "public",
      "limitations": [
        "Public visibility does not determine license compatibility.",
        "The embedded observation is reproducible, but live repository metadata can change after the observation time."
      ]
    },
    {
      "id": "ev-readme",
      "kind": "document",
      "title": "Dify README at pinned revision",
      "resourceRef": "github:langgenius/dify@ad90cb911138f6b27af996c87afe34fbb5a4ed16:README.md",
      "publicUri": "https://github.com/langgenius/dify/blob/ad90cb911138f6b27af996c87afe34fbb5a4ed16/README.md",
      "digest": "sha256:51647e1180794278e006c7e1925eec056d5b68a036893143849ef83ad695e7e2",
      "observedAt": "2026-09-05T00:00:00+07:00",
      "producer": { "name": "github-contents", "version": "2022-11-28" },
      "accessHint": "public",
      "license": "LicenseRef-Dify-Modified-Apache-2.0",
      "limitations": [
        "Feature and resource statements are upstream documentation claims, not runtime proof."
      ]
    },
    {
      "id": "ev-license",
      "kind": "document",
      "title": "Dify modified license at pinned revision",
      "resourceRef": "github:langgenius/dify@ad90cb911138f6b27af996c87afe34fbb5a4ed16:LICENSE",
      "publicUri": "https://github.com/langgenius/dify/blob/ad90cb911138f6b27af996c87afe34fbb5a4ed16/LICENSE",
      "digest": "sha256:232cf91474932d5110ed304e53b6b742a58463857c571fae803fdf2ac36d7bb3",
      "observedAt": "2026-09-05T00:00:00+07:00",
      "producer": { "name": "github-contents", "version": "2022-11-28" },
      "accessHint": "public",
      "license": "LicenseRef-Dify-Modified-Apache-2.0",
      "limitations": [
        "This records technical evidence and is not legal advice.",
        "A qualified human must assess the intended tenancy, branding, and distribution model."
      ]
    },
    {
      "id": "ev-security-policy",
      "kind": "document",
      "title": "Dify security policy at pinned revision",
      "resourceRef": "github:langgenius/dify@ad90cb911138f6b27af996c87afe34fbb5a4ed16:SECURITY.md",
      "publicUri": "https://github.com/langgenius/dify/blob/ad90cb911138f6b27af996c87afe34fbb5a4ed16/SECURITY.md",
      "digest": "sha256:e9e3e170a9dd268aabd4700795833dec8de387113ecb449ff4a692908a2b08c4",
      "observedAt": "2026-09-05T00:00:00+07:00",
      "producer": { "name": "github-contents", "version": "2022-11-28" },
      "accessHint": "public",
      "license": "LicenseRef-Dify-Modified-Apache-2.0",
      "limitations": [
        "A disclosure policy does not establish that a release is secure or suitable for production."
      ]
    },
    {
      "id": "ev-compose",
      "kind": "document",
      "title": "Dify Docker Compose manifest at pinned revision",
      "resourceRef": "github:langgenius/dify@ad90cb911138f6b27af996c87afe34fbb5a4ed16:docker/docker-compose.yaml",
      "publicUri": "https://github.com/langgenius/dify/blob/ad90cb911138f6b27af996c87afe34fbb5a4ed16/docker/docker-compose.yaml",
      "digest": "sha256:8644fa96677327d4af69483bc0dcdf16a21b37d4ed52aaba0e3702bea7168ba8",
      "observedAt": "2026-09-05T00:00:00+07:00",
      "producer": { "name": "github-contents", "version": "2022-11-28" },
      "accessHint": "public",
      "license": "LicenseRef-Dify-Modified-Apache-2.0",
      "limitations": [
        "The manifest was inspected as text and not applied.",
        "Services present in the manifest may be optional and do not prove default runtime behavior."
      ]
    },
    {
      "id": "ev-docker-readme",
      "kind": "document",
      "title": "Dify Docker deployment guide at pinned revision",
      "resourceRef": "github:langgenius/dify@ad90cb911138f6b27af996c87afe34fbb5a4ed16:docker/README.md",
      "publicUri": "https://github.com/langgenius/dify/blob/ad90cb911138f6b27af996c87afe34fbb5a4ed16/docker/README.md",
      "digest": "sha256:ad4ed57b7901e35efb10a189ce6fe01b610a164885639a23a555f4e28d3e23d9",
      "observedAt": "2026-09-05T00:00:00+07:00",
      "producer": { "name": "github-contents", "version": "2022-11-28" },
      "accessHint": "public",
      "license": "LicenseRef-Dify-Modified-Apache-2.0",
      "limitations": [
        "Documented deployment procedures were not executed."
      ]
    }
  ],
  "claims": [
    {
      "id": "claim-candidate-relevance",
      "statement": "Pinned upstream documentation describes workflows, retrieval, agents, model management, observability, APIs, and a self-hosting path relevant to this evaluation.",
      "classification": "confirmed",
      "evidenceIds": ["ev-readme", "ev-compose", "ev-docker-readme"],
      "limitations": ["This establishes documented candidate relevance, not feature completeness or target-environment fitness."]
    },
    {
      "id": "claim-run-pilot",
      "statement": "Run only a bounded sandboxed local pilot after license review; do not adopt or deploy yet.",
      "classification": "recommendation",
      "evidenceIds": ["ev-readme", "ev-license", "ev-compose", "ev-security-policy", "ev-docker-readme"],
      "limitations": ["The recommendation does not authorize execution and does not establish production suitability."]
    }
  ],
  "hypotheses": [
    {
      "id": "hyp-functional-fit",
      "statement": "Dify is relevant enough to evaluate for visual workflows, retrieval applications, model integrations, and API access.",
      "status": "supported",
      "evidenceIds": ["ev-readme"]
    },
    {
      "id": "hyp-local-feasibility",
      "statement": "Dify can start and operate within the target local environment and resource budget.",
      "status": "proposed",
      "evidenceIds": ["ev-readme", "ev-compose", "ev-docker-readme"]
    },
    {
      "id": "hyp-license-fit",
      "statement": "The Dify license is compatible with the intended tenancy, branding, and distribution model.",
      "status": "proposed",
      "evidenceIds": ["ev-license", "ev-repository-metadata"]
    },
    {
      "id": "hyp-operational-fit",
      "statement": "The team can securely operate, observe, back up, upgrade, and recover the required Dify services.",
      "status": "proposed",
      "evidenceIds": ["ev-compose", "ev-docker-readme", "ev-security-policy"]
    }
  ],
  "checks": [
    {
      "id": "check-revision-pinned",
      "description": "Confirm that inspected upstream files resolve from the recorded immutable commit and match recorded SHA-256 digests.",
      "status": "passed",
      "required": true,
      "evidenceIds": ["ev-revision", "ev-readme", "ev-license", "ev-security-policy", "ev-compose", "ev-docker-readme"]
    },
    {
      "id": "gate-license-review",
      "hypothesisId": "hyp-license-fit",
      "description": "Obtain qualified review of the modified license for the exact intended use.",
      "status": "inconclusive",
      "required": true,
      "evidenceIds": ["ev-license", "ev-repository-metadata"]
    },
    {
      "id": "gate-local-pilot",
      "hypothesisId": "hyp-local-feasibility",